{
  "id": "earth_orbit_04",
  "display_name_key": "SECTOR_EARTH_ORBIT_04",
  "biome": "earth_orbit",
  "seed": 91827,
  "difficulty": 4,
  "map": {
    "half_extents": [
      5200,
      3200
    ],
    "debris_density": 0.94,
    "cluster_count": 6
  },
  "salvage_tables": [
    {
      "id": "earth_orbit_ops",
      "weight": 100
    }
  ],
  "landmarks": [
    "relay_satellite"
  ],
  "contract": {
    "type": "valuable_recovery",
    "target_value": 420
  },
  "modifiers": [
    "valuable_salvage"
  ],
  "depot": {
    "position": [
      -980,
      620
    ]
  }
}
