{
  "id": "blue_nebula_03",
  "display_name_key": "SECTOR_BLUE_NEBULA_03",
  "biome": "blue_nebula",
  "seed": 120045,
  "difficulty": 10,
  "map": {
    "half_extents": [
      6200,
      3900
    ],
    "debris_density": 1.05,
    "cluster_count": 8
  },
  "salvage_tables": [
    {
      "id": "blue_nebula_research",
      "weight": 100
    }
  ],
  "landmarks": [
    "research_outpost",
    "comms_array"
  ],
  "contract": {
    "type": "standard_cleanup",
    "target_percent": 88
  },
  "modifiers": [
    "valuable_salvage",
    "dense_debris"
  ],
  "depot": {
    "position": [
      -1260,
      -520
    ]
  }
}
