{
  "id": "earth_training_02",
  "display_name_key": "SECTOR_EARTH_TRAINING_02",
  "biome": "earth_orbit",
  "seed": 42017,
  "difficulty": 2,
  "map": {
    "half_extents": [
      4800,
      3000
    ],
    "debris_density": 0.88,
    "cluster_count": 5
  },
  "salvage_tables": [
    {
      "id": "earth_training",
      "weight": 100
    }
  ],
  "landmarks": [
    "service_satellite"
  ],
  "contract": {
    "type": "standard_cleanup",
    "target_percent": 75
  },
  "modifiers": [
    "dense_debris"
  ],
  "depot": {
    "position": [
      -860,
      520
    ]
  }
}
