{
  "id": "mars_freight_02",
  "display_name_key": "SECTOR_MARS_FREIGHT_02",
  "biome": "mars_freight",
  "seed": 66240,
  "difficulty": 7,
  "map": {
    "half_extents": [
      5700,
      3500
    ],
    "debris_density": 1,
    "cluster_count": 7
  },
  "salvage_tables": [
    {
      "id": "mars_freight",
      "weight": 100
    }
  ],
  "landmarks": [
    "comms_array",
    "fractured_moonlet"
  ],
  "contract": {
    "type": "standard_cleanup",
    "target_percent": 82
  },
  "modifiers": [
    "dense_debris"
  ],
  "depot": {
    "position": [
      -1120,
      -540
    ]
  }
}
