{
  "id": "earth_training_01",
  "display_name_key": "OPS_CONTRACT_TITLE",
  "biome": "earth_orbit",
  "seed": 18422,
  "difficulty": 1,
  "map": {
    "half_extents": [
      4800,
      3000
    ],
    "debris_density": 0.75,
    "cluster_count": 4
  },
  "salvage_tables": [
    {
      "id": "earth_training",
      "weight": 100
    }
  ],
  "landmarks": [
    "service_satellite"
  ],
  "contract": {
    "type": "standard_cleanup",
    "target_percent": 70
  },
  "modifiers": [
    "light_debris"
  ],
  "depot": {
    "position": [
      -720,
      -520
    ]
  }
}
